{
  "$schema": "https://json-schema.org/draft/2020-12/schema",
  "$id": "https://edam.spec/evidence-export-package-1.0.schema.json",
  "title": "Evidence Export Package v1",
  "type": "object",
  "required": ["package_version","package_id","db_id","purpose","created_at","created_by",
               "object_refs","segment_manifests","anchor_records","public_keys",
               "timestamp_certificates","verification_instructions","chain_of_custody_log","export_signature"],
  "additionalProperties": false,
  "properties": {
    "package_version": { "type": "string", "const": "evidence-export-package-1.0" },
    "package_id": { "type": "string", "format": "uuid" },
    "db_id": { "type": "string", "minLength": 1 },
    "purpose": { "type": "string", "enum": ["legal_audit","financial_audit","regulator","court_dispute","internal_investigation"] },
    "created_at": { "type": "string", "format": "date-time" },
    "created_by": { "type": "string", "minLength": 1 },
    "case_reference": { "type": "string" },
    "object_refs": {
      "type": "array", "minItems": 1,
      "items": {
        "type": "object",
        "required": ["object_id","object_type","worm_object_key","event_hash"],
        "additionalProperties": false,
        "properties": {
          "object_id": { "type": "string", "format": "uuid" },
          "object_type": { "type": "string", "enum": ["cce","execution_result","db_audit_event"] },
          "worm_object_key": { "type": "string" },
          "event_hash": { "type": "string", "pattern": "^sha256:[0-9a-f]{64}$" }
        }
      }
    },
    "segment_manifests": { "type": "array", "items": { "type": "string" }, "minItems": 1 },
    "anchor_records": { "type": "array", "items": { "type": "string" }, "minItems": 1 },
    "public_keys": {
      "type": "array", "minItems": 1,
      "items": {
        "type": "object",
        "required": ["key_id","algorithm","public_key"],
        "additionalProperties": false,
        "properties": {
          "key_id": { "type": "string" },
          "algorithm": { "type": "string" },
          "public_key": { "type": "string" },
          "revoked_at": { "type": ["string","null"], "format": "date-time" }
        }
      }
    },
    "timestamp_certificates": { "type": "array", "items": { "type": "string" }, "minItems": 1 },
    "verification_instructions": {
      "type": "object",
      "required": ["spec_id","spec_hash"],
      "additionalProperties": false,
      "properties": {
        "spec_id": { "type": "string" },
        "spec_hash": { "type": "string", "pattern": "^sha256:[0-9a-f]{64}$" },
        "procedure_ref": { "type": "string" }
      }
    },
    "chain_of_custody_log": { "type": "array", "items": { "type": "object" }, "minItems": 1 },
    "export_signature": {
      "type": "object",
      "required": ["algorithm","signing_key_id","signature","package_hash"],
      "additionalProperties": false,
      "properties": {
        "algorithm": { "type": "string" },
        "signing_key_id": { "type": "string" },
        "signature": { "type": "string" },
        "package_hash": { "type": "string", "pattern": "^sha256:[0-9a-f]{64}$" }
      }
    }
  }
}
